{
  "$schema": "https://dungeonbreak.dev/schemas/titles.schema.json",
  "schemaVersion": "titles.v1",
  "description": "Titles = achievement-earned; reference archetype (1:1) and rarity. Unlock = predicate list. All predicate spellIds must exist in spells.json.",
  "unlockPredicateTypes": [
    "castSpell { spellId, count }",
    "evolveSpell { count }",
    "reachDepth { depth }",
    "searchCount { count }",
    "winCombat { count }",
    "restCount { count }",
    "roomsDiscovered { count }",
    "fleeCount { count }",
    "talkToNpc { count }",
    "fameReached { value }",
    "bossDefeated { count }"
  ],
  "titles": [
    { "titleId": "sweet_talker", "name": "Sweet Talker", "archetypeId": "sweet_talker", "rarityId": "uncommon", "unlockCondition": [{ "type": "castSpell", "spellId": "charm", "count": 3 }] },
    { "titleId": "forgemaster", "name": "Forgemaster", "archetypeId": "forgemaster", "rarityId": "rare", "unlockCondition": [{ "type": "evolveSpell", "count": 1 }] },
    { "titleId": "wanderer", "name": "Wanderer", "archetypeId": "wanderer", "rarityId": "common", "unlockCondition": [{ "type": "reachDepth", "depth": 6 }] },
    { "titleId": "delver", "name": "Delver", "archetypeId": "delver", "rarityId": "common", "unlockCondition": [{ "type": "searchCount", "count": 5 }] },
    { "titleId": "warden", "name": "Warden", "archetypeId": "warden", "rarityId": "uncommon", "unlockCondition": [{ "type": "winCombat", "count": 3 }] },
    { "titleId": "hunter", "name": "Hunter", "archetypeId": "hunter", "rarityId": "uncommon", "unlockCondition": [{ "type": "winCombat", "count": 5 }] },
    { "titleId": "tactician", "name": "Tactician", "archetypeId": "tactician", "rarityId": "rare", "unlockCondition": [{ "type": "evolveSpell", "count": 2 }] },
    { "titleId": "showrunner", "name": "Showrunner", "archetypeId": "showrunner", "rarityId": "rare", "unlockCondition": [{ "type": "fameReached", "value": 50 }] },
    { "titleId": "paladin", "name": "Paladin", "archetypeId": "paladin", "rarityId": "uncommon", "unlockCondition": [{ "type": "winCombat", "count": 10 }] },
    { "titleId": "berserker", "name": "Berserker", "archetypeId": "berserker", "rarityId": "uncommon", "unlockCondition": [{ "type": "winCombat", "count": 7 }] },
    { "titleId": "scout", "name": "Scout", "archetypeId": "scout", "rarityId": "common", "unlockCondition": [{ "type": "roomsDiscovered", "count": 20 }] },
    { "titleId": "healer", "name": "Healer", "archetypeId": "healer", "rarityId": "uncommon", "unlockCondition": [{ "type": "restCount", "count": 5 }] },
    { "titleId": "face", "name": "Face", "archetypeId": "face", "rarityId": "common", "unlockCondition": [{ "type": "castSpell", "spellId": "persuasion", "count": 5 }] },
    { "titleId": "shadow", "name": "Shadow", "archetypeId": "shadow", "rarityId": "rare", "unlockCondition": [{ "type": "fleeCount", "count": 3 }] },
    { "titleId": "alchemist", "name": "Alchemist", "archetypeId": "alchemist", "rarityId": "rare", "unlockCondition": [{ "type": "evolveSpell", "count": 3 }] },
    { "titleId": "sentinel", "name": "Sentinel", "archetypeId": "sentinel", "rarityId": "uncommon", "unlockCondition": [{ "type": "winCombat", "count": 8 }] },
    { "titleId": "blademaster", "name": "Blademaster", "archetypeId": "blademaster", "rarityId": "rare", "unlockCondition": [{ "type": "winCombat", "count": 15 }] },
    { "titleId": "pyromancer", "name": "Pyromancer", "archetypeId": "pyromancer", "rarityId": "uncommon", "unlockCondition": [{ "type": "castSpell", "spellId": "flame_bolt", "count": 10 }] },
    { "titleId": "frostmage", "name": "Frost Mage", "archetypeId": "frostmage", "rarityId": "uncommon", "unlockCondition": [{ "type": "castSpell", "spellId": "frost_bite", "count": 8 }] },
    { "titleId": "stormcaller", "name": "Stormcaller", "archetypeId": "stormcaller", "rarityId": "rare", "unlockCondition": [{ "type": "castSpell", "spellId": "spark_shock", "count": 10 }] },
    { "titleId": "shadowdancer", "name": "Shadowdancer", "archetypeId": "shadowdancer", "rarityId": "rare", "unlockCondition": [{ "type": "fleeCount", "count": 5 }] },
    { "titleId": "runekeeper", "name": "Runekeeper", "archetypeId": "runekeeper", "rarityId": "rare", "unlockCondition": [{ "type": "evolveSpell", "count": 2 }] },
    { "titleId": "diplomat", "name": "Diplomat", "archetypeId": "diplomat", "rarityId": "common", "unlockCondition": [{ "type": "talkToNpc", "count": 10 }] },
    { "titleId": "brawler", "name": "Brawler", "archetypeId": "brawler", "rarityId": "common", "unlockCondition": [{ "type": "winCombat", "count": 5 }] },
    { "titleId": "trickster", "name": "Trickster", "archetypeId": "trickster", "rarityId": "uncommon", "unlockCondition": [{ "type": "castSpell", "spellId": "intimidation", "count": 5 }] },
    { "titleId": "zealot", "name": "Zealot", "archetypeId": "zealot", "rarityId": "rare", "unlockCondition": [{ "type": "winCombat", "count": 20 }] },
    { "titleId": "wayfinder", "name": "Wayfinder", "archetypeId": "wayfinder", "rarityId": "common", "unlockCondition": [{ "type": "reachDepth", "depth": 3 }] },
    { "titleId": "veteran_delver", "name": "Veteran Delver", "archetypeId": "delver", "rarityId": "rare", "unlockCondition": [{ "type": "searchCount", "count": 25 }] },
    { "titleId": "champion", "name": "Champion", "archetypeId": "paladin", "rarityId": "legendary", "unlockCondition": [{ "type": "bossDefeated", "count": 1 }] },
    { "titleId": "first_blood", "name": "First Blood", "archetypeId": "hunter", "rarityId": "common", "unlockCondition": [{ "type": "winCombat", "count": 1 }] },
    { "titleId": "crowd_pleaser", "name": "Crowd Pleaser", "archetypeId": "showrunner", "rarityId": "uncommon", "unlockCondition": [{ "type": "fameReached", "value": 25 }] }
  ]
}
